{
  "$schema": "./model_prices.schema.json",
  "schemaVersion": 1,
  "lastUpdated": "2026-09-30",
  "currency": "USD",
  "sources": [
    {
      "id": "retail-azure-deepseek-models",
      "title": "Azure Retail Prices API: Foundry Models, Azure Deepseek Models, every region",
      "url": "https://prices.azure.com/api/retail/prices?$filter=serviceName%20eq%20'Foundry%20Models'%20and%20productName%20eq%20'Azure%20Deepseek%20Models'%20and%20priceType%20eq%20'Consumption'",
      "retrievedOn": "2026-09-30"
    },
    {
      "id": "retail-azure-llama-models",
      "title": "Azure Retail Prices API: Foundry Models, Azure Llama Models, every region",
      "url": "https://prices.azure.com/api/retail/prices?$filter=serviceName%20eq%20'Foundry%20Models'%20and%20productName%20eq%20'Azure%20Llama%20Models'%20and%20priceType%20eq%20'Consumption'",
      "retrievedOn": "2026-09-30"
    },
    {
      "id": "retail-azure-mistral-models",
      "title": "Azure Retail Prices API: Foundry Models, Azure Mistral Models, every region",
      "url": "https://prices.azure.com/api/retail/prices?$filter=serviceName%20eq%20'Foundry%20Models'%20and%20productName%20eq%20'Azure%20Mistral%20Models'%20and%20priceType%20eq%20'Consumption'",
      "retrievedOn": "2026-09-30"
    },
    {
      "id": "retail-azure-openai",
      "title": "Azure Retail Prices API: Foundry Models, Azure OpenAI, every region",
      "url": "https://prices.azure.com/api/retail/prices?$filter=serviceName%20eq%20'Foundry%20Models'%20and%20productName%20eq%20'Azure%20OpenAI'%20and%20priceType%20eq%20'Consumption'",
      "retrievedOn": "2026-09-30"
    },
    {
      "id": "retail-azure-openai-embedding",
      "title": "Azure Retail Prices API: Foundry Models, Azure OpenAI Embedding, every region",
      "url": "https://prices.azure.com/api/retail/prices?$filter=serviceName%20eq%20'Foundry%20Models'%20and%20productName%20eq%20'Azure%20OpenAI%20Embedding'%20and%20priceType%20eq%20'Consumption'",
      "retrievedOn": "2026-09-30"
    },
    {
      "id": "retail-azure-openai-gpt5",
      "title": "Azure Retail Prices API: Foundry Models, Azure OpenAI GPT5, every region",
      "url": "https://prices.azure.com/api/retail/prices?$filter=serviceName%20eq%20'Foundry%20Models'%20and%20productName%20eq%20'Azure%20OpenAI%20GPT5'%20and%20priceType%20eq%20'Consumption'",
      "retrievedOn": "2026-09-30"
    },
    {
      "id": "retail-azure-openai-reasoning",
      "title": "Azure Retail Prices API: Foundry Models, Azure OpenAI Reasoning, every region",
      "url": "https://prices.azure.com/api/retail/prices?$filter=serviceName%20eq%20'Foundry%20Models'%20and%20productName%20eq%20'Azure%20OpenAI%20Reasoning'%20and%20priceType%20eq%20'Consumption'",
      "retrievedOn": "2026-09-30"
    },
    {
      "id": "retail-azure-phi-models",
      "title": "Azure Retail Prices API: Foundry Models, Azure Phi Models, every region",
      "url": "https://prices.azure.com/api/retail/prices?$filter=serviceName%20eq%20'Foundry%20Models'%20and%20productName%20eq%20'Azure%20Phi%20Models'%20and%20priceType%20eq%20'Consumption'",
      "retrievedOn": "2026-09-30"
    },
    {
      "id": "learn-ptu-sizing",
      "title": "Determine PTU sizing for a workload, Microsoft Learn: input TPM per PTU and output-to-input ratio by model",
      "url": "https://learn.microsoft.com/azure/foundry/openai/how-to/provisioned-throughput-sizing",
      "retrievedOn": "2026-09-30"
    },
    {
      "id": "learn-ptu-billing",
      "title": "Provisioned throughput billing and cost management, Microsoft Learn: PTUs are billed by the hour whether or not a deployment takes calls",
      "url": "https://learn.microsoft.com/azure/foundry/openai/concepts/provisioned-throughput-billing",
      "retrievedOn": "2026-09-30"
    }
  ],
  "prices": [
    {
      "id": "commercial.deepseek.all-models.any.datazoneprovisionedmanaged.r1",
      "cloud": "commercial",
      "publisher": "DeepSeek",
      "model": "*",
      "deploymentType": "DataZoneProvisionedManaged",
      "regions": [
        "australiaeast",
        "belgiumcentral",
        "centralindia",
        "francecentral",
        "germanynorth",
        "germanywestcentral",
        "italynorth",
        "japaneast",
        "japanwest",
        "jioindiawest",
        "koreacentral",
        "northeurope",
        "norwayeast",
        "polandcentral",
        "southeastasia",
        "southindia",
        "spaincentral",
        "swedencentral",
        "switzerlandnorth",
        "switzerlandwest",
        "westeurope"
      ],
      "ptuHourly": 1.2,
      "effectiveFrom": "2026-09-01",
      "sourceIds": [
        "retail-azure-deepseek-models",
        "learn-ptu-billing"
      ],
      "retailMeters": {
        "product": "Azure Deepseek Models",
        "provisioned": "Provisioned Managed Data Zone Unit"
      },
      "notes": "The hourly rate for one PTU, for every model this publisher sells in Azure. A reservation costs less; enter its monthly amount as a price for the deployment."
    },
    {
      "id": "commercial.deepseek.all-models.any.datazoneprovisionedmanaged.r2",
      "cloud": "commercial",
      "publisher": "DeepSeek",
      "model": "*",
      "deploymentType": "DataZoneProvisionedManaged",
      "regions": [
        "brazilsouth",
        "canadacentral",
        "canadaeast",
        "centralus",
        "eastasia",
        "eastus",
        "eastus2",
        "northcentralus",
        "qatarcentral",
        "southafricanorth",
        "southcentralus",
        "uaenorth",
        "uksouth",
        "westcentralus",
        "westus",
        "westus2",
        "westus3"
      ],
      "ptuHourly": 1.1,
      "effectiveFrom": "2025-04-01",
      "sourceIds": [
        "retail-azure-deepseek-models",
        "learn-ptu-billing"
      ],
      "retailMeters": {
        "product": "Azure Deepseek Models",
        "provisioned": "Provisioned Managed Data Zone Unit"
      },
      "notes": "The hourly rate for one PTU, for every model this publisher sells in Azure. A reservation costs less; enter its monthly amount as a price for the deployment."
    },
    {
      "id": "commercial.deepseek.all-models.any.globalprovisionedmanaged",
      "cloud": "commercial",
      "publisher": "DeepSeek",
      "model": "*",
      "deploymentType": "GlobalProvisionedManaged",
      "ptuHourly": 1.0,
      "effectiveFrom": "2025-04-01",
      "sourceIds": [
        "retail-azure-deepseek-models",
        "learn-ptu-billing"
      ],
      "retailMeters": {
        "product": "Azure Deepseek Models",
        "provisioned": "Provisioned Managed Global Unit"
      },
      "notes": "The hourly rate for one PTU, for every model this publisher sells in Azure. A reservation costs less; enter its monthly amount as a price for the deployment."
    },
    {
      "id": "commercial.deepseek.all-models.any.provisionedmanaged.r1",
      "cloud": "commercial",
      "publisher": "DeepSeek",
      "model": "*",
      "deploymentType": "ProvisionedManaged",
      "regions": [
        "australiaeast",
        "centralindia",
        "jioindiawest",
        "southindia"
      ],
      "ptuHourly": 2.28,
      "effectiveFrom": "2026-09-01",
      "sourceIds": [
        "retail-azure-deepseek-models",
        "learn-ptu-billing"
      ],
      "retailMeters": {
        "product": "Azure Deepseek Models",
        "provisioned": "Provisioned Managed Regional Unit"
      },
      "notes": "The hourly rate for one PTU, for every model this publisher sells in Azure. A reservation costs less; enter its monthly amount as a price for the deployment."
    },
    {
      "id": "commercial.deepseek.all-models.any.provisionedmanaged.r2",
      "cloud": "commercial",
      "publisher": "DeepSeek",
      "model": "*",
      "deploymentType": "ProvisionedManaged",
      "regions": [
        "belgiumcentral",
        "canadacentral",
        "canadaeast",
        "germanynorth",
        "germanywestcentral",
        "italynorth",
        "polandcentral",
        "southafricanorth",
        "spaincentral",
        "swedencentral",
        "switzerlandnorth",
        "switzerlandwest",
        "uaenorth"
      ],
      "ptuHourly": 2.36,
      "effectiveFrom": "2026-09-01",
      "sourceIds": [
        "retail-azure-deepseek-models",
        "learn-ptu-billing"
      ],
      "retailMeters": {
        "product": "Azure Deepseek Models",
        "provisioned": "Provisioned Managed Regional Unit"
      },
      "notes": "The hourly rate for one PTU, for every model this publisher sells in Azure. A reservation costs less; enter its monthly amount as a price for the deployment."
    },
    {
      "id": "commercial.deepseek.all-models.any.provisionedmanaged.r3",
      "cloud": "commercial",
      "publisher": "DeepSeek",
      "model": "*",
      "deploymentType": "ProvisionedManaged",
      "regions": [
        "brazilsouth",
        "northeurope",
        "southeastasia",
        "westeurope"
      ],
      "ptuHourly": 2.72,
      "effectiveFrom": "2026-09-01",
      "sourceIds": [
        "retail-azure-deepseek-models",
        "learn-ptu-billing"
      ],
      "retailMeters": {
        "product": "Azure Deepseek Models",
        "provisioned": "Provisioned Managed Regional Unit"
      },
      "notes": "The hourly rate for one PTU, for every model this publisher sells in Azure. A reservation costs less; enter its monthly amount as a price for the deployment."
    },
    {
      "id": "commercial.deepseek.all-models.any.provisionedmanaged.r4",
      "cloud": "commercial",
      "publisher": "DeepSeek",
      "model": "*",
      "deploymentType": "ProvisionedManaged",
      "regions": [
        "centralus",
        "eastus",
        "eastus2",
        "northcentralus",
        "southcentralus",
        "westcentralus",
        "westus",
        "westus2",
        "westus3"
      ],
      "ptuHourly": 2.0,
      "effectiveFrom": "2025-04-01",
      "sourceIds": [